,event,cleandiscipline_new,itype,gendersquash,cleantarget_new,perpetrator_new,story_word_count
0,"Working as grad researcher, although paid minimum wage, c.15 years ago. Prof leading project constantly stared at my chest and on one occasion brushed past my bottom, deliberately. Same happened (staring) when I started in my current institution 12 years ago - male staff member in permanent post stared at my chest every time we discussed anything including my teaching on his module.",Humanities,Multiple,Male,Graduate Student,Graduate Student,63
1,"There is a senior male scholar in my field who regularly--compulsively even--oversteps boundaries with most women he encounters in professional settings. Over the past decade (and I know from senior colleagues that this has gone on much longer), I have both experienced and witnessed inappropriate behavior from him on multiple occasions at conferences, invited talks, etc., including: 1. excessively touching/stroking women's arms, shoulders, and backs, 2. giving out French ""bisous"" that just happen, as if by accident, to land on the recipient's lips, 3. handing out his phone number with a casual invitation to visit him at his hotel later. ",Humanities,Elite Institution,Male,Graduate Student,Graduate Student,101
2,"First incident: As an undergrad in communication studies and SFSU in the '80's my instructor encouraged me to apply for the grad program. When I did, after I took the entry exam he invited me to his home in order to let me know his decision about my acceptance in to the program. I asked him if I got in and he said he hadn't decided yet. He told me that I had taken the wrong exam and my scores were borderline.  He gave me a tour of his house and in his marital bedroom showed me a picture of his son. He said, ""Isn't he handsome"" , ""Sure"" I said. ""Don't I look like him?"" he asked. ..I didn't know what to say, then he joked about me dating his son and then said he wasn't available, so why not date him instead? I was shocked and extremely uncomfortable I was young and nervous and didn't know what sexual harassment was but I just started getting sick to my stomach. I said, ""I am sorry, I have a boyfriend and I better get going now""  and I left his house flustered. Walking across the street away from his house I was terrified and shaken. I didn't know what was going on but I knew it wasn't good. I was depressed and sick to my stomach for days. Later I realized  he was holding the key to my future and was indirectly asking me to go to bed with him in order to get it. I felt glad that I didn't entirely understand what was happening at the time. I hadn't heard of sexual harassment or quid per quo. But later I always wondered if I got into the program on my own merit, because he needed new students in the program, or if he was afraid I would complain?", Social sciences,Other Type of School,Other,Graduate Student,Graduate Student,313
3,"My graduate school professor had long been mildly inappropriate with me (comments on my body, disparaging remarks about my partner, wanting to discuss sexual preferences) but I always laughed it - and the other rumors and complaints against him - off as him being my ""friendly grad school professor"". Until he raped me, after offering me a very lucrative consulting job at his company. ",Applied science,Regional College,Other,Graduate Student,Faculty,65
4,"At an off campus event with multiple faculty and luminaries (`40+ people) from the field. A speech was made where everyone at the event was paying strong attention to the speaker. The speech was in fact a joke/toast where it was told that several of the men in attendance wanted to perform amorous/sexual acts with me (I was called out by name and the speaker pointed at me). I had been in my position for only a few months at the time. No one, male or female (aside from my spouse) at the event ever commented on how inappropriate this was or said they were sorry it occurred. This occurred over 8 years ago and I am still at the same institution due to various circumstances.  ",Applied science,Research Institute,Male,Graduate Student,Faculty,128
5,"First, let me say that I'm a male. While I know that around 10% of all sexual harassment incidents involve men as the victims, I think it is important for all to know that this happens to people of all identities.

While I was in graduate school at a major, private university, one of my male, professors would regularly make physical contact with me (kissing me, sticking his tongue in my ear, etc.). He was openly flirtatious with all but would become much more aggressive in private. I felt as if I had no choice but to allow this due to his status and power over my career and, at times, I felt like it might be something that was allowing me to remain in the program. This continued even after I concluded classes as I felt like I needed him as a reference.

I look back now in disgust at what he did but I fully remember the feeling that I had no choice but to submit. I think about this every day now that I'm a professor myself and wield the same power over grad students at a major university. We have to stop this.",Humanities,Elite Institution,Male,Graduate Student,Faculty,195
6,"I eventually had the experience of feeling that at least 3 male faculty on my campus, 2 of whom were in my department, pursued friendships with me outside of classes and formal campus events in several instances, and 2 with the goal of establishing consensual romantic dialogues.  After I went to lunch with the 3rd, which was a bit too long for my comfort (an intellectual dialogue that lasted 5 hours) I felt uncomfortable when he left me several phone messages eager to get together again, distanced myself from him, removed him from my dissertation committee, and never had anything else to do with him for my remaining years in the program.  He seemed to get the message.  In that case I cannot be sure whether he was trying to cross the line but took no chances.  One, I would say, played on my professional vulnerability and isolation and attempted to cultivate the proverbial ""school girl crush.""",Humanities,Elite Institution,Male,Graduate Student,Undergraduate Student,161
7,"I was almost raped by a fellow student, but a random person came along at the last minute and interrupted/stopped it. Oct 1979, Rice University, under some trees along the main road through campus. The student who tried to rape me was a walking buddy, the person who had volunteered to walk me safely across campus at night. These walk with a buddy patrols were set up after a young woman was found raped and murdered near campus.",Humanities,Elite Institution,Male,Graduate Student,Graduate Student,78
8,"In my first semester as a grad student in 1990, my mentor (who had previously bragged about his pornography collection and jokingly asked me to bring in nude photos - which I dismissed as ""sick humor"") began massing my shoulders while I was entering data on a computer. Suddenly, his hands went under my shirt and onto my breasts. I left immediately and walked around campus in a daze.", Social sciences,Research Institute,Male,Graduate Student,Faculty,69
9,"I was his best student, a great writer, supremely talented, he said.  I was 16, 17, 18 -- he was my high school English teacher.  He permanently tied my sense of myself as an intellectual and a literary scholar to my sense of worth as a sexual person.  He sexually molested me for three years.  It was the 1980s.  I complained, and nothing happened to him.",Humanities,Other Type of School,Male,Undergraduate Student,Graduate Student,71
10,"Committee member and professor for the class I was TAing called me into his office a few days before my qualifying exam to tell me he found me attractive and his marriage wasn't that great, and that he'd been flirting with me all semester. He thought that because I smiled at his jokes in lecture, I must like him back too. I told him I wasn't interested and he swore several times and asked if I had a boyfriend. He still assumed he'd be my dissertation chair and got upset when I took him off the committee a few months later. ",Humanities,Elite Institution,Male,Graduate Student,Chair/Dean/Head,102
11,During my first semester of my masters program I quickly discovered that the newest male assistant professor for whom I was a TA and RA was sleeping with a friend of mine (second year student) who he not only supervised clinically but was also on her thesis committee. The particularly egregious aspect of all of it was knowing she'd recently lost a parent after a long battle with cancer and she was clearly still grieving. , Social sciences,Research Institute,Male,Graduate Student,Graduate Student,76
12,"2004-2007 As one of only a few girls in the applied math department, I was subject to nearly constant comments that were derogatory. To be honest, I don't think the boys intended to be hurtful-they just didn't know any better. Comments included things said to my face such as ""well, you had an easier time getting in because they had to get girls"" as well as things said to each other while I was in the room (clearly within hearing distance) such as ""The problem with being in this program is that all of the women are so ugly. Not that we could date them even if they weren't because smart women are so unattractive."" When I brought it to the attention of the supervisor, department head, and other officials, I was told that this was something to be expected, and if I couldn't learn to tune  them out, I wouldn't survive in any mathematics endeavor. ",Applied science,Research Institute,Male,Graduate Student,Faculty,158
13,"Dean's ""small talk"" at the beginning of our lunch meeting included a story about how she'd recently volunteered at a sporting event so she could see female athletes naked. Later offered to give me a massage. Same dean kissed a female colleague on the lips at a dinner party, and has sent another female colleague ""thinking of you"" emails.",Humanities,Research Institute,Female,Faculty,Chair/Dean/Head,59
14,"I was an MBA student at a meeting with two faculty members to discuss a recently awarded grant application I had helped submit.  Present at this meeting was a senior male accounting professor and a female who worked in administration and was responsible for government grants.  In that lunch I remember the male  placing his hand on the thigh of the woman in charge of government grants.  He had hoped to do it undetected by me but it was obvious in part, due to her expression.  I had never witnessed anything like this and did not know what to do.  I did nothing and pretended not to have noticed.  She was visibly embarrassed and stiffly took his hand and moved it away from her thigh.  I have often felt remorse at not having said anything and I have no idea whether the accounting professor had a relationship with this administrator or not.  What I do remember is how awkward the situation was how embarrassed the administrator looked when it happened.  She was much younger than him and unmarried.  He was married.  It was certainly inappropriate and my first real encounter with such a thing. ",Applied science,Other Type of School,Male,Undergraduate Student,Faculty,207
15,"Rockstar professor in cultural studies was known to do drugs with and fuck female students, frequently went out drinking with us after meetings, was know to have abused his ex wife. He was involved in our student/ faculty of color anti-racist campus organizing and the only South Asian, radical male prof.  No one that I know of, including feminist of color profs, confronted him- I'm guessing they either didn't know or felt like we ""needed the support"". He didn't hit on me but he did on other young women of color students I was close to. This was in the late 90s",Humanities,Regional College,Male,Graduate Student,Faculty,103
16,"Dude professor (assistant director of our speech & debate team) made lewd comments to and about an undergraduate woman on the team. Like, ""your dress is too short, i can see your ass. if you pull it down, i can see your tits."" ""your shirt is showing off too much of your tits."" ""she's a blow up doll for young college boys"". also, general sex jokes at women. also would intimidate women through the silent treatment and emotional manipulation if we didn't do what he wanted.", Social sciences,Regional College,Male,Graduate Student,Faculty,86
17,"For my sister who refuses to discuss: circa 1999, she was an undergraduate researcher (she was about 21 at the time) who was hired to do data samples at rural location about two hours away. She was working ""for"" [international/male] doctoral candidate. They checked in at hotel and he insisted they share a room with twin beds. She awoke middle of the night to him standing at the end of her bed, possibly masturbating. She told him to go away, called me and I managed to contact a nearby family member who immediately went to pick her up middle of the night. ",Natural sciences,Research Institute,Male,Graduate Student,Graduate Student,103
18,"A student at UC-Santa Barbara exposed his erect penis to me while I was lecturing in class.  No students sat in the front row, and this one did in the middle of the semester.  After class I called the Dean, who wanted nothing to do with the episode.  Told me to report to 'Campus Police. I reported to Campus Police who were outside my classroom for the next lecture, and when that very same student came up to speak to me, I asked him to accompany me out the door, where he was nabbed by the police.  The result: the police reported to me that this was ""a biological accident."" Nothing done.  The student later came to my office complaining that I should have discussed this ""problem"" with him instead of calling the police.  He frightened me, which seemed to be his intention.   Very difficult finishing up the semester with that looming. ", Social sciences,Elite Institution,Male,Graduate Student,Undergraduate Student,161
19,My boss's chief of staff (who claims to be gay) would stare at my breasts in one-on-one updates with him about my work. This happened on several occasions. I was perplexed by his behavior. He was also always trying to limit my role in the office. Everyone worked under him in the office and I was a lone wolf who was hired by his boss directly. May be it was his way to make me feel small and uncomfortable. I was very uncomfortable with his stares. This behavior continued for 2.5 years (from Oct 2014 to Dec 2016),Applied science,Elite Institution,Male,Graduate Student,Staff,98
20,"During a four-year graduate program, my partner and I were routinely made the victims of sexual gossip. Fellow graduate students spread malicious rumors about our sex lives with the intent of destroying not only our reputations, but any potential of building relationships both inside and outside of our graduate program. One professor also engaged in the spreading of these rumors. My partner and I were harassed verbally and over the department listserv. One professor altered both of our teaching assignments, a choice that she explained stemmed from our relationship status.  ",Humanities,Research Institute,Other,Graduate Student,Graduate Student,92
21,"There are many incidents that I could report in laboratory, remote fieldwork, and conference settings. One that sticks out was at a national conference when a peer and I were invited to a hotel party with several people I trusted. When I arrived, there were about 10 people in the hotel room, including four senior male researchers in my field. It seemed innocent enough at first, but after being offered a glass of whiskey, one of the senior males grabbed my foot and wouldn't let go. Suddenly, another one of the males was having sex with a former graduate student in the middle of the room. We were all kind of shocked and everyone left the room, but the foot guy kept trying to kiss me on the elevator and another very married senior male wouldn't stop touching my friend. My friend and I eventually escaped, but we were grossed out about these supposedly wonderful researchers. ", Social sciences,Multiple,Male,Graduate Student,Graduate Student,157
22,"My mentor asked me to go to a hotel with him. I laughed and hoped he was joking. He wasn't. He sabotaged my applications to graduate school. When I complained, he got a slap on the hand and I was counseled by the man who handled the complaint that I was not allowed to talk about the matter to anyone else. Of course, I was slandered at my alma mater by the mentor. It took decades to recover and totally altered my chosen career path. Ten years later I was in graduate school in a totally different field. ",Humanities,Regional College,Male,Graduate Student,Staff,99
23,"My advisor admitted, drunkenly, that I reminded him of his ex-wife in ""multiple ways."" This meant he would often be harder on me than any of his other students, and took his anger out on me in ways that were in no way appropriate. I eventually left the field because of his systematic harassment and discrimination. ",Humanities,Research Institute,Other,Graduate Student,Faculty,57
24,"I had befriended one of my current instructors, who was a gay man (I am a cisgender queer man). He was about 10 years older than me. One evening he and I and another student were hanging out having dinner. At one point we were all sitting on a sort of porch swing drinking wine (I was underage). He and the other student started fooling around next to me. I was uncomfortable with this, but then he put his hand on my knee. I got up and walked away. We talked about it later. I just said that it made me uncomfortable and that I wasn't interested. He dropped it. He never tried anything again with me directly, but was always dropping hints and flirting. He made it clear that if I changed my mind, he would take advantage of that.",Formal sciences,Research Institute,Male,Graduate Student,Graduate Student,141
25,"I am a heterosexual man and so was my graduate advisor but that didn't stop him from joking about anally penetrating me on several occasions. No physical abuse ever occurred although he would regularly say things that made me and the other grad students uncomfortable. Screaming at us and throwing things in the lab, sometimes at us but mostly just ""in our direction"", was frequent. I'm a former college athlete, am probably thirty pounds heavier and six inches taller than my advisor, not to mention a third his age. So he was no physical threat to me. He also mentioned once to another grad student that sometimes I looked at him like I was going to punch him in the nose. I would never do that, despite how much he deserved it, because I'm non-violent and professional. This is all to say that no one is immune from this kind of harassment, even straight, male, muscle bound action stars like Terry Crews. He clearly was not actually sexually attracted to me, he just enjoyed the power of being able to say and do horrible things with impunity. Even now that I've left his lab I'm still dependent on him for letters of recommendation, which he uses as another form of leverage and power over me.",Applied science,Regional College,Other,Graduate Student,Faculty,215
26,"At a conference when applying to Ph.D. Programs I met my first choice mentor. He invited me and my research assistant friends to dinner, and after asked if I minded dropping off his laptop at his hotel before meeting up with others at a bar. We were talking about my research interests and I didn’t want to cut short the conversation, and agreed. In the hotel he touched my leg, tried to kiss me repeatedly, and even laid on top of me while encouraging me to reciprocate. I was stunned and wanted to get away without leaving a negative impression. He had/has a lot of status in the field and was worried about upsetting him. I eventually left at 2am, ashamed of not being braver. He emailed me repeatedly after that, as if we had a romantic connection. When I declined the spot in his lab he was clearly emotional and upset. Going elsewhere was a great decision. I still dread running into him at conferences. ", Social sciences,Research Institute,Male,Graduate Student,Faculty,167
27,"Two separate occasions of the American Historical Association. As a younger PhD student (23), I went to my first AHA and was introduced to professors at other universities. One man challenged my on the thesis of my diss, picking apart every answer I gave him. Then, when I mentioned to the group that the heater was broken in my room he handed me his key under the table and said it was hot in his own. At another AHA, this time as a full-time faculty member, I was having a conversation with two male professors from a R1 outside of the conference hotel. It was later in the evening and I was trying to make it back to my room and they hailed a cab and physically tried to put me in it. I had to break free to get back into the hotel, the valet helping me get away. I received an email from one of them the next day (I had not shared my contact information) asking me on a date.",Humanities,Elite Institution,Male,Graduate Student,Faculty,173
28,"At 2010 conference in shared hotel room with cohort, white, male phd candidate put unwanted penis in WoC phd candidate's hand and then on body, other colleagues just laughed and shrugged. White, male phd candidates have inappropriate sexual relations with undergraduate female students. White, male phd candidates and faculty have inappropriate sexual relations with in field study subjects and community liaisons, some known to be underage. ",Humanities,Research Institute,Male,Graduate Student,Graduate Student,67
29,"I don't even know where to start, so many things happened when I was a graduate student. One professor made wildly inappropriate comments and discussions about his sexual past in class. Every class. He once asked me, when I came to class with a bruise on my face from falling off of my bike, ""What? Does your boyfriend beat you or something?"" (in front of the entire class). Another professor physically assaulted me by slapping my arm hard and grabbing it to get me off of a wheelchair ramp (I didn't realize it was a wheelchair ramp, and there wasn't a wheelchair user coming). He later screamed at me in front of undergraduate students. I had a male graduate student peer smack me on the backside with his backpack when were were standing in front of an entire lecture hall full of undergraduates. When I was an undergraduate a departmental admin. assistant started a rumor that I was sleeping with a male professor. Oh, I have also faced some  awful harassment from some male undergraduates, when I was a graduate student and again as a Visiting Assistant Professor.",Humanities,Multiple,Male,Graduate Student,Graduate Student,189
30,"There have actually been a number of instances at my institution, both directly related myself and others. There is a tenured faculty member who is known to be ""creepy"" and to look down student's shirts when speaking to them, I was told never to be alone in a room with him, and to always be covered up when speaking to him. This faculty member also likes to get students' phone numbers to talk about things from class, but it is very uncomfortable. Additionally, this same faculty member is known for having failed an entire group of students in class because they were critical of two other females in that class who had gone out for drinks with the faculty member. The graduate school has tried to fire him on numerous occasions, but have not be successful.

Another faculty member was known for having an affair with a former student. 

A graduate student, who is also teaching undergraduate courses, is known for hanging out with, drinking/partying with, dating, and sleeping with undergraduate students. When people complained about it (students and full-time faculty), the department chair said there was nothing he could do about it. 

I personally have had students ask me out and become defensive when I said no. At another institution, a student did this, and then followed me to my car to harass me about why I wouldn't date him. I had to specifically say, ""are you going to follow me to my car?"" for him to leave me alone. 

A friend had a student send her inappropriate emails relating to male genitalia and how he would like to do particular things to her. She complained to the department head who said there was nothing they could do. 

I have also had students question my ability to teach the course by questioning my age and qualifications. 

While it's not exactly sexual harassment, the department at my current institution is also well known for overt sexism and favoritism of white men when making hiring and class assignment choices. ",Humanities,Regional College,Male,Graduate Student,Faculty,338
