,event,cleandiscipline_new,itype,gendersquash,cleantarget_new,perpetrator_new,story_word_count
61,"About 20 years ago I was assaulted in a car and asked if I wanted to have sex by a college professor I was taking a summer workshop with. He actually grabbed my pussy, trite as that sounds now. We were alone together, on a professional errand outside the institution. I was a student paying to be in his class and making great personal sacrifice to be there at all, and I assumed everything about the situation was strictly professional. He must have thought my interest in joining the errand was a come-on? I said no and he left me alone. 2 days later, another young female student approached me with her own report of his inappropriate behavior. The next day another young female student confided in us that she was returning the teacher's interest in her. Student #2 and I reported what was happening to the administration. I had never bonded so intensely and so quickly with another co-student as I did that week. He knew we were on to him and ridiculed us in front of the other students when he could for the rest of the workshop.
",Humanities,Other Type of School,Male,Graduate Student,Graduate Student,190
62,"Group of drunken male students cornered the only female attendee of an off-site, overnight student/post-doc retreat in her room and pressured her to do keg stands with them (I personally witnessed one of these students drinking during my 9am presentation, they were there to get hammered, not for science) She refused and hid in a room with the one sober male student. Group of students then went and did keg stands on her car! Later that night they put porn on the borrowed department projector! I skipped the overnight because I was uncomfortable with the drinking I had seen in prior years, but I had no idea it would get that bad. I’m sorry I wasn’t there to protect my friend and witness it personally so I could have filed a complaint. When behavior was later brought up in a student-only meeting, the lead harasser defended himself by saying that the group was treating her like a sister and denied any problem in the group behavior, I confronted and disagreed, but there were no formal consequences as only the students handled the issue. ",Natural sciences,Research Institute,Male,Graduate Student,Undergraduate Student,184
63,"When I was in my second year, a new graduate student kept harassing me for a whole semester, saying things such as ""We should sleep together"" repeatedly, in public and private instances. He also said stupid things such as ""I would like to organize events with cute undergraduate students"" or ""I like innocent looking girls"". He also said things about his sexual preferences. He also pretended to be my friend to be included in a graduate conference I was going to in Canada, and immediately offered to travel together and go to a hotel together. I was shocked by his behavior.",Humanities,Research Institute,Male,Graduate Student,Graduate Student,101
64,"female colleague in my department stated loudly that I ""looked sexy"" as I entered the room for a department meeting.  Our department is mostly male and only guys were in the room.  I was immediately upset and asked her not to sexualize my body.  I was an assistant professor, she was associate.  It was an underhanded ""compliment."" I was wearing a harvest gold pencil skirt (that I loved) and a loose black sweater that covered my butt.  Boots and tights.  I am a curvy girl and I made sure I was dressed appropriately.",Applied science,Research Institute,Female,Faculty,Faculty,99
65,"I went to see a professor because I was failing a difficult class; he looked me up and down and told me that ""female students should stop going out and obsessing over appearances and social lives."" I had As in every other class. I was considered ""trendy"" in terms of clothing and makeup, but certainly nothing inappropriate or that would interfere with my studies.",Formal sciences,Elite Institution,Male,Undergraduate Student,Faculty,64
66,"In the summer of 2015 I attended my very first academic conference as a graduate student. Three men, also graduate student presenters from programs/universities other than my own, got drunk after the first dinner. Two of them groped me. One of them found the location of my room and hammered on the door and wall trying to get me to let him in at 2am. I was terrified. ",Humanities,Multiple,Male,Graduate Student,Graduate Student,69
67,"As a new Assistant Professor in my first month on the job, I was suddenly kissed by a tenured, male professor. He continued to flirt with me relentlessly. I was scared to rebuff him as I was a single mother and desperate to keep my job. I know this was a minor incident, but it turned out that he was acting much more aggressively sexually with his graduate students, who eventually filed agains him and he has been suspended from his position and may be fired.",Humanities,Research Institute,Male,Faculty,Graduate Student,86
68,"Undergrad senior year, I was taking an independent study with a professor I trusted an admired. 
One day, he stopped me while I was in the middle of presenting a paper to comment on the length of my eye lashes, and occasionally, he would make comments on the clothes I was wearing.  
He also told me at one point that I was ""too pretty to be taken seriously."" I am fairly certain that he thought he was being helpful somehow by telling me this. ",Humanities,Regional College,Male,Graduate Student,Faculty,86
69,"As a junior faculty member, I was always more or less ordered by the men to do things like take notes, order refreshments, reserve spaces for events --in other words, everything they considered ""female"" grunt work.  When I became chair, the outgoing/previous chair (in response to a decision he was less than happy about) told me outright that he had only supported me because he had assumed that he would still run the department and I would just do all the reports and paperwork. After I became dean and the department went back to male leadership, there were two male faculty members (both married), including the chair, blatantly having sexual relationships with grad students: one ended up raping a student while she was knocked out on meds, leaving her pregnant. Already emotionally fragile, she terminated and then spent time in a psych facility trying to deal with the issues.  The women themselves would not come forward because of the power pressure, but their peers came forward, both to voice their concerns and to complain about their perceptions of preferential treatment in the grad program. Both men ultimately felt that these relationships were ""justifiable"" or ""ethical""  because they ended up marrying their grad students, the most fragile of whom (the one who had been raped) gave up her graduate education, entered a marriage full of emotional and physical abuse, became a stereotypical version of the ""barefoot and pregnant"" cliche, and only recently divorced her husband (who, no surprise! was fooling around with grad students). Neither of those faculty members are still employed here, but it took forever to get a policy in place that addressed faculty/student relationship issues. On a less sexually charged front, it is still frustrating to feel virtually ""voiceless"" among otherwise decent men who are not even intentionally sexist (women can come up with a great idea and nobody ""hears"" it until a man says the same thing). ",Humanities,Regional College,Male,Chair/Dean/Head,Graduate Student,324
70,"Propositioned for sex by my current professor in undergraduate writing course. Propositioned for sex by my MA thesis advisor after the defense. Propositioned and harassed by emeritus professor while I worked alone in his home during PhD study. Sexually harassed by supervisor while working as a technology fellow during PhD study. Discovered that my sexual activities in my home had been shared with the rest of the faculty by a neighbor faculty member. In all cases, I spoke directly to the person myself and asked them to stop. In the case of the emeritus professor, I had to also ask my graduate department chair to intervene. Incidents occurred 2000-2014.",Humanities,Multiple,Male,Graduate Student,Faculty,109
71,"I was at a public event with students, faculty and staff at the end of the year and a faculty member gestured to my chest (I'm trans and still had breasts then) and said she hoped everything went well (I assume with my top surgery, which I don't know how she knew about). I know it's not the biggest thing but I felt so incredibly violated to have someone gesturing at and speaking about my chest at all, much less in public with students and my colleagues in close proximity.",Natural sciences,Regional College,Female,Staff,Faculty,90
72,"My professor in my MFA program who was known for getting drunk with  graduate students grabbed my butt at a party in an attempt to get me to dance with him or to sit next to him. He complimented my writing. I quickly shunned his advanced and left the party feeling ashamed, disgusted, and fearful of my fate in the program. 

He got wind of the incident and claimed to ""not remember it."" He called me into his office where I awkwardly accepted his apology, and continued to have to take classes with him for the rest of my program. ",Humanities,Research Institute,Male,Graduate Student,Faculty,102
73,"A series of emails - mostly links to music videos, with suggestive ""interpretive aids."" He was my boyfriend's professor and I told my boyfriend it made me uncomfortable. My boyfriend spoke with him and then came back to me and told me he had said it was just a joke.",Humanities,Elite Institution,Male,Graduate Student,Faculty,50
74,"Major professor constantly lured young women in (particularly women of color/first generation students and otherwise marginalized women in the academy) with promises of being a ""father like"" figure. Part of this relationship was built on young women's willingness to confide in this mentor, including private information about sexual relationships and assertion to these graduate students that they could only be successful with the support of this mentor. Mentor often referenced his own sex life with his wife, made flirtatious comments to women mentees about his desire to pursue a relationship with them, and commented on the physical attractiveness and bodies of these mentees and other women in public spaces. Upon graduating, and realizing how inappropriate this behavior was, I shared my story with other women in our department who were generally aware of these patterns, and many of whom shared the same experiences. ", Social sciences,Research Institute,Male,Graduate Student,Faculty,144
75,"I was approached by a professor at Arizona State University in my practice room around 11:45 pm one night. Blocking the door, he asked that I leave with him. I had to refuse multiple times before he left. After that, I received no more opportunities to play in the ensemble he conducted. ",Humanities,Research Institute,Male,Graduate Student,Faculty,53
76,"When I finished my PhD, my male advisor kissed me on the lips. He had only once before let his hands stray across my chest while reaching across me to open a car door (he was the driver, I was in the passenger seat). A year after I finished, I got married and he said that he'd not felt comfortable telling me he beautiful he thought I was until after I was ""safely married."" A small vignette of this relationship.

When I started graduate school, I was walking outside during a field course and hear a conversation between two male students -- one said ""she's so fat"" and the other said ""I'd still fuck her."" One of several of these types of incidents.

I could go on, but not today.",Natural sciences,Research Institute,Male,Graduate Student,Faculty,128
77,"A professor made sexual comments all through a graduate course.  He talked facetiously about asking sex workers how much different sex acts cost. He would make comments about kissing us. They were non sequiturs in the middle of lecture.  He leaned toward a student and acted like he was going to kiss her and kept talking about it, in the same tone of voice as a mom pretending a spoonful of mashed squash is an airplane. He did this all the course.
Most of the professors in our faculty are sleeping w/ students. Supervisors are sleeping w/ students they supervise. More are than aren't. One professor went to a different college b/c he was sleeping with undergraduate students here. He is the only guy who even got in trouble but he was just sent away. No one cares. Everyone is to afraid to say anything b/c it will ruin your career and also who would we tell. There isn't a place to tell. It's wrong but none of the established faculty think that it is wrong and everybody is doing it.
", Social sciences,Other Type of School,Male,Graduate Student,Faculty,182
78,"I signed up for an independent study after lack of enrollment cancelled an advanced class.  The professor's office was in a locked facility (due to the presence of specialized equipment).  He scheduled our meetings to be after the normal work day.  No one else was around.  No one could get in.  He had a mini-fridge he kept stocked with beer and had always started drinking before I arrived.  He pressured me to drink with him, pressured me to drink faster.  I'd prepare questions about the material, he would tell me stories about past exploits with famous people in the field and make sexual innuendos about the one prominent female scientist, implying past relations with her.  When I tried to redirect, or end the meeting, he would imply that only unintelligent or lazy people would want to talk about that or end the meeting so early.   The first several meetings ran nearly three hours; he would finally let me go once it became obvious that I was never going to ""relax"".  He would go pee in the sink of the adjoining wet lab space that was 30 feet away from his desk rather than end these meeting.  There was a line of sight and could hear him relieve himself.  I would finally be dismissed around 9:30 or 10 pm.  The guy was a ""genius"" professor and I was some idiot graduate student.  I minimized the number of meetings, read every book I could find on the topic, wrote a 15 page paper about the aspect of the technique that interested me the most, turned it in by the end of the semester and hoped the whole thing would go away.  I made sure not another female student crossed the doorway of that facility for the entire time I was at that institute. ",Natural sciences,Elite Institution,Male,Graduate Student,Faculty,318
79,"This is just the worst of several harassers during that degree: From 1999 to 2002 a classmate slowly morphed into a cyber-stalker. Some of the lowlights included: 1) discovering that he had programmed a tracking app that checked every 5 minutes whether I was logged in, and in what room, which explained why he always seemed to show up wanting attention as soon as I arrived at work, 2) the time he insisted that I really meant yes even though I was repeatedly shouting no, because some guy had once told him that erect nipples indicate arousal (it was a hot Saturday afternoon, and I'd briefly gone into the air-conditioned office to grab something, while wearing a tank top), so he wouldn't stop hugging me, 3) the other time he wouldn't stop hugging me and I had to pour my drink down his back to get him to back off, 4) the time he physically blocked me from leaving his apartment, insisting I had to sleep there, then after I tricked him into complacency by pretending to give in, and made a run for the door, he threatened to throw himself over the banister of the very steep staircase if I didn't stop (I did finally convince him to let me leave), and finally, 5) after I cut off all contact, stopped answering my office phone, and told others in my lab not to let him in, he hacked into my email so that he received a copy of all of my incoming mail for 2 months, then unsatisfied with only getting incoming mail not outgoing mail, tried to hack further into the system and finally got caught by the sys admins.",Formal sciences,Research Institute,Male,Graduate Student,Graduate Student,282
