,event,cleandiscipline_new,itype,gendersquash,cleantarget_new,perpetrator_new,story_word_count
0,"I don't even know where to start, so many things happened when I was a graduate student. One professor made wildly inappropriate comments and discussions about his sexual past in class. Every class. He once asked me, when I came to class with a bruise on my face from falling off of my bike, ""What? Does your boyfriend beat you or something?"" (in front of the entire class). Another professor physically assaulted me by slapping my arm hard and grabbing it to get me off of a wheelchair ramp (I didn't realize it was a wheelchair ramp, and there wasn't a wheelchair user coming). He later screamed at me in front of undergraduate students. I had a male graduate student peer smack me on the backside with his backpack when were were standing in front of an entire lecture hall full of undergraduates. When I was an undergraduate a departmental admin. assistant started a rumor that I was sleeping with a male professor. Oh, I have also faced some  awful harassment from some male undergraduates, when I was a graduate student and again as a Visiting Assistant Professor.",Humanities,Multiple,Male,Graduate Student,Graduate Student,189
1,"In my third year of BA, almost immediately after my first supervision with my dissertation supervisor (Lecturer), he text me to ask if I wanted to meet in a hotel. Thinking this was a prank or he meant a hotel coffee shop I dropped by his office to ask what was going on. He told me he had meant casual sex in a hotel-he pointed out how successful women who had said yes had gone on to become, promised me a position on a work experience placement, promised me other perks if I said yes. I said no. That’s when the harassment started. It ranged from him attempting to kiss me during meetings, constant texts, lewd comments, bullying, personal comments, his screen saver blowing x’s (kisses) at me during class, him telling stories of historic occasions when someone said no (I knew the point he was making but the class was confused!), the contacts struggle to get feedback or support for my dissertation without having to be nice to him, be gentle, don’t rock the boat, say no without making him angry. It seems I wasn’t alone. Just as it had reached the point where I was in so deep and struggling a verbal memo was passed around the dept-anyone heard making allegations against this Lecturer would be suspended. This silenced me. I’ve onlybtold two people-my best friend during and my Husband.  I got through the year and then started my MA with a different supervisor. The harassment is some form continued and I was so disheartened and frustrated I tried to get through the course quickly and did not engage in post grad life within the dept. The Lecturer and I stayed in touch every now and then-mostly reference requests. When I decided to return to do a PhD he agreed to meet and discuss my options-I though I’m older, wiser, married so it’ll be different. It wasn’t-as soon as he realised I would continue to say no but that I was more confident in myself (plus I have a Husband built like The Rock!) he became really rude and personal. He told me that there was no point in me doing a PhD-I was too stupid, I should retrain (despite successfully working in the field between my MA and wanting to do a PhD), I would wouldn’t finish the PhD as I might have children or my husbands and might leave me. I held it together until I left-then I cried. I’m now about 6 months of submitting my PhD thesis-a wonderful experience with two supportive male supervisors. ", Social sciences,Elite Institution,Male,Undergraduate Student,Graduate Student,432
2,"As a woman who has been in a consensual relationship with a more senior male in my field, I think it important to note that this does happen. And while the relationship ended badly, I do not believe he has or will ever do anything to harm me professionally. (this is not to say that I would suggest such a relationship to a friend, nor is this intended to in any way minimize the horrible things that have happened to others)",Humanities,Elite Institution,Male,Graduate Student,Faculty,81
3,"I was walking down the hallway with my faculty mentor (male senior faculty) when we passed Prof. X, a male senior faculty member from another department.  Prof. X did not greet me, but greeted my mentor warmly, took his time ogling me up and down like a piece of meat, and told my mentor, ""Oh, I can see YOU'RE having a good day today.""  My mentor laughed and said indeed, he was.  Even though there was no touching, it felt humiliating to be sexually objectified by a colleague, and gross to be objectified in front of my mentor, especially because my mentor did not challenge his peer's behavior.", Social sciences,Regional College,Male,Faculty,Graduate Student,111
4,"Routine creepy comments by a colleague with whom I had just one innocuous conversation at a party. Subsequently told me (to my complete bafflement) that his wife had threatened to leave him because of me. Reconciled myself to gritting my teeth and getting past him politely whenever I ran into him, which was frequently; he and several cronies took up daily positions outside the campus coffee-shop to leer at female colleagues and students. For me (and for other junior colleagues from whom I've heard similar stories) it was an isolated incident, but I later discovered that this same person had been harrassing grad students, in at least two cases amounting to direct physical assault; the university came to some kind of settlement and he's now back teaching on campus, which is appalling.",Humanities,Research Institute,Male,Faculty,Graduate Student,132
5,"When I was an undergraduate, I took a class from a prominent Americanist. I would go to his office hours often, and I felt we had a good rapport. I admired him. Then at the end of the semester, he offered me a ride home. I was the last one to turn in my exam and it was snowing. I lived a mile away. He walked me to his car and then started telling me that he couldn't go through with ""it."" He had a wife and kids at home, he explained. I was floored. I assumed the car ride would be just a car ride. I felt ashamed that I may have led him on as well as naive. This happened around 2005.",Humanities,Research Institute,Male,Graduate Student,Faculty,124
6,"I was in a summer program and my roommate was a female high school senior. She left the program after a graduate student took her on a car ride, where he was driving and she couldn't get out, and told her about what he wanted in a wife and how lonely he was.  I reported his behavior and he then found me in a parking lot late at night when I was walking back to the dorm alone to yell at me and tell me I was ruining his career and how he hadn't done anything and threaten that if I didn't recant what I said I would regret it. When I didn't back down and was entirely ready to engage in a physical altercation, he stormed off instead.",Formal sciences,Elite Institution,Male,Graduate Student,Graduate Student,130
7,"Back in the late eighties at a state school, I had a professor run his fingers through my hair during an office hours meeting (I froze! Didn't know what to do, so unexpected. I was 19). Same school, same department (Theater), a professor, again during office hours, interrupted my question to ask my if I had a sun tan. Your legs look so nice and tan, he said. Ugh. Suffice to say, I transferred schools to study the same subject at another state school. ",Humanities,Research Institute,Male,Graduate Student,Undergraduate Student,85
8,"A male colleague in my department began inappropriate comments and touching the week I was hired as a full-time, tenure track professor.  When I asked him to stop, he became aggressive and hostile and verbally abused me in an extremely threatening and belligerent manner.  This continued for years until I finally filed an internal formal sexual harassment complaint against him.  Following that, although I technically ""won"" against him, I was subjected to retribution in numerous forms for the remainder of my employment at the college.  That went on for about 17 years.  My daily life was filled with incidents. My students were also subjected to problems as a result of his constant harassment of me.",Natural sciences,Regional College,Male,Faculty,Faculty,120
9,"Continually demeaned for being a woman; was told ""We only give full funding for men for all their years of study -- for women, we make them all pay the first year to prove they can cut it""; had all accomplishments unacknowledged or ""disbelieved"" (""but you don't *really* know that language, right?"" -- even though I had studied it for years); Chair touched his ding dong in front of a beloved female faculty member--who then resigned; Chair tried to sabotage PhD dissertation even though prestigious Ivy League postdoc had already been granted (female dean had to step in and make it clear to him his behavior was not appropriate & took the reins thank God)",Humanities,Elite Institution,Male,Graduate Student,Chair/Dean/Head,115
10,"I had set up a meeting with a professor to discuss doing a summer research project with him. During the meeting, he asked me inappropriate questions: whether I had a boyfriend, was he was my ""first love"", things like that. I remember feeling so uncomfortable. I don't remember him talking about his research at all. After the meeting, I told some friends, and I learned that there were all sorts of rumors about this professor and inappropriate relationships with female undergraduates.",Natural sciences,Elite Institution,Male,others,Graduate Student,81
11,"Was working late on a grant and a faculty member offered to buy me dinner, we had a friendly rapport so I saw it as a nice gesture. Afterwards he kissed me and asked me to undress. I immediately left, didn't finish my work, and avoided being alone with him under any circumstances,",Applied science,Elite Institution,Other,Staff,Faculty,53
12,"At the American Sociological Association annual meeting, maybe 6-7 years ago, met a full professor just left one institution in middle America for Virginia Tech, he spoke with me, then noticed a young woman who was an undergraduate was hanging out with him from his institution. I knew some of his former graduate students and they said that he had left his first wife for a graduate student and that he consistently had inappropriate contact with female students. As the night progressed, the undergraduate got drunker and drunker. Then in the early morning, she got text from this professor asking her to come to his hotel room, while he was/is married with his 2nd wife who was a student of his. She showed us the texts on her phone. The former graduate student of this man urged her not to go to his room. The undergraduate left. Fast forward a few more years, saw this same professor, who became chair of the department, again in a professional setting. Spoke with me, then after this encounter would regularly try to chat with me through DM of social media site. ", Social sciences,Research Institute,Male,Graduate Student,Undergraduate Student,189
13,"2007, my academic advisor, in a closed door meeting, sat on the edge of his desk, invaded my personal space, and grabbed my ankle. He then said I was very pretty and asked if I wanted to take off my clothes. I refused and told him he was making me uncomfortable. He shrugged and tried to kiss me and when I pulled away, he laughed and sat back in his chair. He then started to justify he proposition saying he’s done things with students in the past and when I expressed disappointment for disrespecting his marriage and my relationship status he said that he and his wife have an understanding. I repeated that I wasn’t interested and left his office. He later sent me apologetic emails which I deleted, feeling ashamed and confused. I obsessed about whether I had lead him on or talked about inappropriate things that made him think I was receptive. I told a friend, who told me I was over reacting. I constantly wondered if the A I had received in his class was due to the fact that he wanted to sleep with me and not my developing skill in the subject. Aware of his tenured status in the department, I decided the following semester to change my major and never took another class in his department. Of note, two years later, that same friend who dismissed my concerns, was propositioned by the same professor and finally validated my experience. She and another student who had had similar experiences (being cornered and asked for sexual activity by this professor) went to a female professor in the department and with her guidance, the three of us reported our experiences to the Dean of the college. We were made to recount the experiences and told that they would take it from there. If any institutional action was taken, it was unknown to us and the professor is still teaching and probably still harassing his vulnerable female students.",Applied science,Elite Institution,Male,Undergraduate Student,Faculty,330
14,"I was up for a partner hire. I met with a male full professor in the department I wanted to be in; he asked me about the progress of the negotiations. I said that right then it looked like I would be split between several departments. He said, ""I hope we get a thigh.""",Humanities,Research Institute,Male,Faculty,Faculty,54
15,"Senior professor has a long history of harassing female graduate students and post-docs in his lab and beyond (inappropriate comments about appearance, inappropriate physical contact, invitations to step into his conference hotel room after a long night of drinking at conference, professional promises are made for 'special' attention, inappropriate text messaging...} [the rest redacted]",Applied science,Elite Institution,Other,Graduate Student,Graduate Student,54
16,"My advising professor asked me to sleep with him, and when I said no, he quietly retreated from his adviser roll. I had no backup as he was the last of the discipline in the department. His behavior was well known: he had an open string of girlfriends drawn from the graduate pool over the years. He had one when he hit on me. Presumably she was wowed by trips to France and fine wine. But his contempt for women was obvious. By that time he was in his 60s.
I took my qualifying exams and left the institution to scratch out a study site on my own to complete my dissertation. I fought hard - without meaningful letters of recommendation - for a career in academia. Even still, 20 years later, I do not have a network of invested academics 'who raised me'. 
The response of the institution - a female chair at the time- was cliche. ""Oh that's just how he is and we can't legislate love"".  LOVE?? 
It easily set my career back 10 years, but I guess, after having read so many stories of women ""hounded out"" (excellent terms, btw), I should consider myself ""one of the lucky ones"".
At that time in the late 80s and early 90s, several women were harassed in the short time I was there. The climate at the time gave both senior and junior male profs approval for selecting partners from the grad pool with impunity. ", Social sciences,Research Institute,Male,Graduate Student,Graduate Student,246
17,"After I passed my comprehensive exams, my PhD advisor sent me an electronic gift with a sexually suggestive title. I tried to ignore it, hoping it was a misunderstanding, but after a couple of days he inquired if I got his gift. I wrote back telling him that I did not accept it because it was disturbing and inappropriate, and asked him to drop the topic so that we can continue with a strictly professional relationship. He replied with a story detailing his feelings, telling me how smart I was,  and that he thought it was mutual ""because [I] was seeking [his] advice."" Luckily, all this was by email, since he was abroad at the time, and by the time he came back I was going abroad for a research.",Humanities,Elite Institution,Male,Graduate Student,Graduate Student,131
18,"After choosing to do an honors thesis on how college students understand consent, my thesis advisor said he had to ""introduce"" me to the field of sex research by telling me stories about how his own advisor had breastfed her child in front of him, and how he had to prove he could talk to her about his research while her bare breast was exposed, and that I needed to learn to be similarly comfortable. He described a time he performed oral sex on his sleeping partner, who awoke during the incident and was so upset she locked herself in the bathroom. Once, when I wore an outfit (shorts with tights under them) that exposed the tattoo on my thigh, he reached out and touched it while remarking, ""you know, based on my research, women with large tattoos like this generally have a lot of sexual partners"" and continued to make comments about my tattoos, piercings, and sexuality while I was alone with him in his office. He the invited me to get Chinese food with him, which I declined. My thesis was already overdue and he had already caused me significant delays, and my admission to graduate school was dependent on me turning in my thesis, so I completed the work as quickly as possible so I could submit the thesis and never see him again. ", Social sciences,Research Institute,Male,Graduate Student,Faculty,228
19,"My direct supervisor's wife was having a garage sale and I dropped off clothes that I didn't want any more.  Apparently a bra was in this pile.  My direct supervisor sent me an email that he wanted to talk with me about my donation.  Not realizing his frame of mind, I went to his office where he proceeded to talk about what he had imagined with this bra.  When I spoke of it with colleagues, several of them reported even more flagrant harassment situations with him (chasing them around the conference table, explicit suggestive remarks). ",Humanities,Research Institute,Male,Chair/Dean/Head,Graduate Student,100
20,"I was an undergrad at a community college and I had a meeting with my English professor to talk about a paper. After giving me feedback, once comment including I should use more of my own voice, he ""playfully"" said to get out of here before he would have to spank me, as he held the paper up over his head about to perform the action. I nervously laughed and left. I was 19. ",Humanities,Research Institute,Male,Undergraduate Student,Faculty,75
21,"A professor made sexual comments all through a graduate course.  He talked facetiously about asking sex workers how much different sex acts cost. He would make comments about kissing us. They were non sequiturs in the middle of lecture.  He leaned toward a student and acted like he was going to kiss her and kept talking about it, in the same tone of voice as a mom pretending a spoonful of mashed squash is an airplane. He did this all the course.
Most of the professors in our faculty are sleeping w/ students. Supervisors are sleeping w/ students they supervise. More are than aren't. One professor went to a different college b/c he was sleeping with undergraduate students here. He is the only guy who even got in trouble but he was just sent away. No one cares. Everyone is to afraid to say anything b/c it will ruin your career and also who would we tell. There isn't a place to tell. It's wrong but none of the established faculty think that it is wrong and everybody is doing it.
", Social sciences,Other Type of School,Male,Graduate Student,Faculty,182
22,"I was ABD doing research at a small archive which had given me a fellowship.  Part of the fellowship included free residence on site adjacent to the archive.  The archive and residence were in rural Pennsylvania, and at the time I was in residence only I and the live-in academic director of the archive, a more senior male ABD from another institution, were living on site.  One other full time staff person was on site during the day but I was told not to bother her.  The male director started off nice enough, but over the course of my month long fellowship, started to make comments about my weight, my appearance, and the appearance of the female high school student who worked a few days a week. Comments escalated to things about how lucky or whipped my male partner must be to put up with me, and when another male fellow arrived who was polite and friendly, comments about how we must be having an affair.  The man making the comments was the person administering my fellowship, and the residence was isolated in a rural area without doors that locked, so I decided to leave early.  I explained the situation to my dissertation director, who was supportive once he found out the details, but advised against reporting to the archive's board of trustees because it would either do nothing or prevent me from getting future funding.  While the man who harassed me was still at the archive, I told all the women intending to work there about what happened to me, and most experienced similar.  He has since left the position.",Humanities,Research Institute,Male,Graduate Student,Graduate Student,279
23,"Did not directly happen to me but to people around me. Lab head regarded male students as future colleagues, female students as sexual object. So no matter the merits, the men were treated to behaviors that would foster their professional careers, while women were objects of use or scorn. Said lab head was banging a student he also supervised. ", Social sciences,Research Institute,Male,Graduate Student,Chair/Dean/Head,60
24,"Long-standing history of predatory behaviour by male TAs (mostly Master's students) toward fellow MA students and undergraduate students in their classes. This behaviour likely based on their ""superiority"", playing on insecurities of junior colleagues and students.
TAs dated undergraduate students in their seminars. Professors were informed and there were no consequences. Brock University is a toxic work environment with unhappy scholars who behave poorly and get no reprimand. ",Humanities,Research Institute,Other,Graduate Student,Faculty,68
25,"The teaching assistant in charge of the Intro to Modernism class at CU Boulder’s English department would stand in front of me in class, say my name, and then say “You should see me naked.”  He would also mention he was married and his wife was pregnant, so he would run 10 miles a day to stay in shape. Then he would make suggestive comments about my appearance or body in front of other students in class and then tie these to whatever text we were reading. This was 1990. The semester after I took that class with him, there was a fire drill in the English department building and he came up to me while I was outside with my classmates and started groping me and kissing my neck. I was stunned. My peers asked if he was my boyfriend—I told them he was my TA from the previous semester.",Humanities,Research Institute,Male,others,Graduate Student,152
26,"In the fall of 2001, I was working in my first few months of my first professional job in a private housing company at a university in south Texas. The assistant director of housing began sexually harassing other females and myself. He was not our direct supervisor, though he was above us in rank. The harassment would vary from comments - comments made to me included that we should be married, as we acted like an old married couple - to unwanted touching. At one point, he would randomly hug us. My coworker was making copies, and he came up from behind her and wrapped his arms around her. 

My coworkers and I approached the associate director, our direct supervisor, who then approached the director of housing and our regional manager, each of whom were male. While the associate director advocated for strict action in the situation, the director and regional manager just told him to stay away from us. 

Unfortunately, the associate director took a position at another university in town, and after he left, we were forced to report directly to the assistant director. My peer, the one who had been hugged at the copy machine, also left, which left myself and our student employees. He began micromanaging my work, checking upon my whereabouts constantly and questioning my tasks. The situation took a toll on me, and when my previous supervisor offered me a position in his department, I immediately took the position and left.",Natural sciences,Research Institute,Male,Undergraduate Student,Chair/Dean/Head,247
27,"A colleague, on the first day of my job, showed me texts with another male colleague discussing me. In the conversation, they discussed my attractiveness, and discussed that X (colleague who was showing me his phone) should date me. In it, they acknowledge I am married and therefore ""off limits,"" but never that this is inappropriate. These interactions continued, and I felt unsure what to do because it was never a quid pro quo situation, but one that was clearly meant to make me feel uncomfortable. On the last day of that academic year, upon entering this colleague's group office, he asked, ""Why do you always wear shirts that make me look at your tits?"" I left in shock. The colleague apologized at the opening of the following school year.",Humanities,Other Type of School,Other,Undergraduate Student,Faculty,130
