,event,cleandiscipline_new,itype,gendersquash,cleantarget_new,perpetrator_new,story_word_count
31,"On my second day of class in my first year of seminary a professor invited me into his office after class. He asked me a series of personal questions under the guise of offering spiritual direction. He asked explicitly about my divorce and current marital status, then raised his eyebrows and informed me that I certainly could be remarried by now. His class lectures frequently revolved around sex, which was unusual for a class in Christian Church History. He would say inappropriate things to the female students. One day he asked about what we think when a ‘hunk’ walks by. He would also make objectifying statements about women. When I complained about it he would tell me that some feminist theologians think that we need to be talking about push up bras and sexuality. He never respected me as a theologian and made clear his amusement of me, particularly when a male classmate made a disparaging remark towards me. My classmates look up to him and he has a good reputation in the community as a pastor. He claims to be a women’s advocate. I doubted my own experiences until he finally commented on my “slinky dress,” (I was wearing a modest sleeveless blouse behind a podium) in a photo of me at a public speaking event at a local  church. He also made fun of a mutual friend and colleague because I had expressed admiration for him as a chaplain (which is the field I’m preparing for.) He would encourage us to speak up and then remind us that the faculty have so much power over grades, and professional/academic recommendations.
",Humanities,Other Type of School,Male,Graduate Student,Graduate Student,272
32,"I was in supervision with a tenured faculty member at my university and was telling her about a child who drew a picture for me. She responded by telling me that the child likely drew that picture for me because sometimes my cleavage shows. She suggested that in the future, I bend over in front the mirror every day before I leave the house to make sure I feel okay about leaving in what I'm wearing.", Social sciences,Regional College,Female,Graduate Student,Faculty,76
33,"A fellow female PhD in my department was verbally and emotionally abused by her (male Professor) PhD supervisor to the point of suicide. I was her only confident, after it had been going on for years. When I sought help from my department (suicide cannot be kept secret), I experienced victim blaming and silence. My (male) boss tried to walk out of a 'rehabilitation meeting' (to get back to work effectively) to avoid taking responsibility for the situation. Eventually, I left the department (physically by changing offices, though my PhD is still fully connected to the department) to prevent remaining in a constant state of hyper arousal and hyper vigilance and to find peace enough to work and regain my sanity. I am now completely isolated from my department. Good news - the PhD received her degree! The status of her mental health is perhaps less than good news. ", Social sciences,Research Institute,Male,Graduate Student,Graduate Student,150
34,"A dated a fellow graduate student. When we broke up, he stalked me, threatened me, broke into my apartment, and tried to physically attack me. I got a restraining order and he got felony charges. I reported this to my department chair but they continued to offer him TA positions. He then groomed and brutally raped, assaulted, and stalked an undergraduate. After a 2+ year investigation, he was expelled, but his expulsion was overturned and converted to a suspension. He has taught at several small local colleges since then.",Humanities,Research Institute,Male,Graduate Student,Graduate Student,89
35,"I took a course 2-3 years ago co-taught by some ""distinguished"" older history and classics professors at Yale. Many of the assignments were presentation-based, and these professors would make a point of commenting on female students' posture and attire as part of ""presentation feedback."" Of course male students did not receive similar feedback. At one point, rape was discussed by one of the professors (it had come up in a literary work) in a very casual and dismissive way. On the whole, these events made me feel like I was not taken seriously as a female student.",Humanities,Elite Institution,Other,Undergraduate Student,Faculty,97
36,"I feel funny writing this, as I have been very lucky and not experienced the really terrible kinds of things that many others have reported. But I'm writing it anyway, to demonstrate that these kinds of issues have been with us for a long time; and that they stay with you for a long time - in my case, 40 years. My event happened in the mid-1970s. I was a really good teacher and had put in my hours so I would be awarded one of the few lectureship positions available to grad students. I wasn't given the lectureship, and I asked my advisor why.  I'll never forget him telling me that ""You have too much sex appeal to be successful in academia,"" and the award had to go to the student who had the most potential to succeed. Ironically, in a way, that person was a woman, apparently without so much sex appeal.", Social sciences,Research Institute,Male,Graduate Student,Faculty,155
37,"A professor made comments upon the attractiveness of me and my fellow female students. This became a pattern, even past graduation. Female students joked about how they knew not to arrive late to his class, as they would end up sitting next to him and he would habitually stroke or touch the arms of any female students sitting beside him (never male). After an event with wine which both students and faculty members attended, numerous female students shared stories of this professor placing his arm around them and giving them a squeeze, stroking their faces flirtatiously, commenting upon their age in a jokingly flirty manner, and referring to them as ""sweetheart.""",Humanities,Elite Institution,Male,Graduate Student,Graduate Student,111
38,"At a last-night party at a major academic conference in 2015, a senior academic, who knew my face but had spoken to me only once before (a day or two previously, when I'd stopped him after his paper to tell him how his work intersected with my master's thesis), came up to me in a crowded ballroom. I was engaged in conversation with friends. He, approximately a foot taller than me and at least twice my weight, put his arm around my waist and leaned down to whisper into my ear. ""I'm a happily married man, but that dress [that you're wearing] is killing me.""",Humanities,Regional College,Male,Graduate Student,Graduate Student,105
39,"It was my first day at work at Chapman College (now Chapman University), in 1994, as a TT professor with a shiny new degree in gender history. At that time there were no other tenured or tenure-track women in my department but there were two women in the Social Sciences division. Both of them took me aside, separately, to warn me that I should never ever say anything about professors dating students because our dean had just divorced his first wife to marry the undergraduate he had been sleeping with. One defended this by saying that he had waited until the undergraduate had earned her degree before marrying her. I went back on the job market immediately.",Humanities,Regional College,Male,Faculty,Graduate Student,117
40,"After being encouraged to collaborate with another early career colleague in another department who had similar interests (and who I had already been in a few meetings with), this colleague suggested we get together for dinner to talk over our ideas. At that point something should have clicked--why dinner and not coffee, lunch, or even a beer after work? But I went, the dinner was fine, I went home without incident. The next time I saw him, we had  chat in my office and at the end he said he had been surprised to learn I had a husband (who I had mentioned over our meal), because he thought he had felt something between us (keep in mind this guy is also married). I affirmed I was happily married and not looking for anything but a professional relationship. Later that day I got an email apologizing but also digging the hole deeper, ""I thought I felt a spark between us"", etc. ", Social sciences,Research Institute,Male,Graduate Student,Graduate Student,163
41,"Undergraduate male student read creative piece aloud about sexual and/or fantasies with female and male students in the class, referring to us by name. Professor knew of the content of this piece prior to this student reading it aloud and allowed it to be read. In fact, she encouraged it.",Humanities,Research Institute,Male,Graduate Student,Graduate Student,50
42,"When I was a graduate student, every year, students and professors from another university (same department) come to visit our institution to use our libraries and materials. We always host a dinner for them. One year, I sat next to a newly-hired associate professor from the other institution who had I only met briefly years before. As we chatted, I accidentally dropped my silverware on the floor. I leaned under the table to get it, and as I did, bumped his leg with my arm. I apologized. With a smile, he said ""no, that's entirely unacceptable, I'll have to get back at you,"" and he then proceeded to pinch my buttocks. I was stunned, and so I did not say anything. When my adviser across the table saw me looking uncomfortable, he asked, ""what are you all talking about?"" The professor said ""oh nothing, we're simply molesting each other."" I simply turned red, and forced a laugh. My adviser looked confused, but then went back to his conversation. I moved my chair away from him, and quickly found a way to leave the table to socialize elsewhere. Because I almost never see him, and can avoid him when I do, I did not do anything about it. ",Humanities,Elite Institution,Male,Graduate Student,Faculty,208
43,"It was well known that he had had affairs with students before, the age gap between him and his wife made that apparent. We assumed that this was why the girls, they were always girls, who he invited into his inner circle were overwhelmingly queer. He was brilliant and respected and his letters of recommendation were rumored to remain unfinished until they made his wife cry. I babysat his children, did yard work, and bartended his parties. He used to take me to concerts, operas, and plays - just the two of us. He waited until just after I had graduated before he tried to kiss me, while his kids were in the other room. I ducked and made a hasty exit. He was invited to my graduation party, schmoozed with my friends and family, shook my father's hand, and then called me 6 times after he had left to ask if I had really meant it when I said 'love you' to him and his family as they left. He refused me feedback on my final paper unless we could 'go over it one on one' and sent me late night texts about how he missed me and wish we could slip away or travel to italy together. It shook me because he was my mentor throughout college, and I realized that he wasn't grooming me because he thought I was talented or capable, but because he wanted to sleep with me. ",Humanities,Regional College,Other,Graduate Student,Graduate Student,244
44,"When I was an undergrad at the University of Chicago and in the early years of grad school at Penn, I was sexually harrassed by a mentor. He put enormous pressure on me to respond to his desires and I resisted. When he and I moved to Penn, there was a moment when, in a sick moment, he stuck his tongue inside my mouth and I let him feel me. ", Social sciences,Elite Institution,Male,Graduate Student,Faculty,71
45,"When I was a PhD candidate, I was invited back to a  hotel room during a party at a field station by a professor from another university who was planning collaborations with my adviser (and someone who for a brief period I thought might be a future post-doc adviser). I said no thank you, he persisted, and after the third effort to talk me into it despite stating repeatedly that I was happily married, I finally got up, said good night and left the party. I told my adviser about the incident the next day and expressed disinterest in working on any future collaborations. When we got back to the university, he required me to spend lab time on a collaborative project (that took time away from finishing my own work) with this person, despite what I had told him. I was not entirely surprised by this response, sadly, since my adviser also made multiple comments implying I was fat and should take up running during my time in his lab as well.",Natural sciences,Research Institute,Male,Graduate Student,Graduate Student,174
46,"My advising professor asked me to sleep with him, and when I said no, he quietly retreated from his adviser roll. I had no backup as he was the last of the discipline in the department. His behavior was well known: he had an open string of girlfriends drawn from the graduate pool over the years. He had one when he hit on me. Presumably she was wowed by trips to France and fine wine. But his contempt for women was obvious. By that time he was in his 60s.
I took my qualifying exams and left the institution to scratch out a study site on my own to complete my dissertation. I fought hard - without meaningful letters of recommendation - for a career in academia. Even still, 20 years later, I do not have a network of invested academics 'who raised me'. 
The response of the institution - a female chair at the time- was cliche. ""Oh that's just how he is and we can't legislate love"".  LOVE?? 
It easily set my career back 10 years, but I guess, after having read so many stories of women ""hounded out"" (excellent terms, btw), I should consider myself ""one of the lucky ones"".
At that time in the late 80s and early 90s, several women were harassed in the short time I was there. The climate at the time gave both senior and junior male profs approval for selecting partners from the grad pool with impunity. ", Social sciences,Research Institute,Male,Graduate Student,Graduate Student,246
47,"After a consensual encounter that turned into sexual assault/rape, he told colleagues in my department and in at least 5 other departments about how I was ""crazy"" and how I wouldn't leave him alone, and that they shouldn't work with me on grants and proposals because I was a ""manipulative slut"" who ""wasn't even that good in bed.""", Social sciences,Research Institute,Male,Graduate Student,Graduate Student,58
48,"In December of 2015, the Chair of my department got angry at me for questioning a scheduling decision and told me that he would like me to ""lift my skirt."" He then proceeded to tell me how many times he ""has thoughts about me"" and had to ""stop himself from coming down to my office."" After I sent him an email asking him not to speak like that to me anymore, he sent me three emails (to my university as well as my private email address) and put a 2-page typed letter under my office door.  He admitted in those emails and the letter what he had said and did.  So, this was not a ""he said/she said"" -- it was a ""she said/he agreed.""  After the email and letter under my door, which very much made my skin crawl, I filled out a harassment complaint.",Applied science,Regional College,Male,Chair/Dean/Head,Chair/Dean/Head,149
49,"11 years ago, there was a party thrown at a graduate student house and a few professors came by. One arrived with his friend and graduate research assistant. He was the only faculty member for there for a portion of the party. While students were drinking, this faculty member starting making comments to one of the women in the graduate program about her looks, the shape of her body, etc. She ignored him, she went to the kitchen to get more wine. He followed her and continued to make comments. She was trying to open the bottle of wine and was having trouble getting the cork out. He started laughing and made a sexually suggestive comment about how it looked as she tugged on the neck of the bottle. All the students were stunned, there was some uncomfortable laughter. This same professor made comments publicly in his classroom about the attractiveness of a female colleague. He was an associate professor, she was a new assistant. He pulled up her ratemyprofessors profiled in class, she had a hot pepper rating for her attractiveness and he put a picture of her up and said that her body was attractive but not her face. He also frequently visited college bars and clubs in downtown College Station claiming it was for his ""research"" and he always went with his grad assistant who was complicit with his behavior. He would take pictures with young blonde undergrads, print them out and post them outside of his office door. ", Social sciences,Research Institute,Male,Undergraduate Student,Faculty,253
50,"A job candidate came to our institution.  During the course of his interview, dinner and job talk he made numerous sexist comments about women, was handsy with the junior female faculty members (hands on arm, touching back, etc) and not with male faculty members, and made all of the junior female faculty feel uncomfortable.  When we expressed this, as a group, to the rest of our department several people still advocated for hiring this person.  ",Natural sciences,Research Institute,Male,Undergraduate Student,Graduate Student,79
51,"He was my English teacher at the university where I did my BA. This was three years ago. He would make comments in class about the boy sitting next to me being unable to concentrate because I was sitting next to him. He continued to pick on people (read boys) who would sit next to me. He would ask me to meet him separately and then ask me what was wrong. He never let it go when I told him everything was fine. Later, he would tell my friends (when I was standing with them) that I act like I am scared of him and he has no idea why. He would also make indirect comments about me in class. Second year, we didn't have his class. But when I passed by him in the first week of second year and ducked to avoid meeting his gaze, he sent someone to call me to meet him. Ever since then I have tried really hard to avoid him. And after I refused to meet him, he has never called me. ",Humanities,Elite Institution,Male,Undergraduate Student,Undergraduate Student,180
52,"I needed three letters of recommendation for several highly competitive post-graduate funding programs. Cultivated a senior faculty member in one of my departments (I doubled-majored). Had heard rumors of sexual relationships he'd had with former students. He began to request I come to office hours, once or twice each week, during which he'd stand up from his chair and come around to the edge of the desk, perching on the edge, close to where I sat in a guest chair. Gave me extracurricular reading for out-of-class, one-on-one discussion (on the grounds that I was ""very gifted"" and ""doing superior work""), hugs at odd moments, nicknames/endearments -- all verbally, nothing via e-mail. I felt like I was being groomed. Didn't feel like I had any material complaint to take to the Chair (who was also writing me rec letters), and was afraid to alienate this person since the app deadlines were approaching and I had no replacement rec letter writers to call on. I changed my schedule in order to avoid his office hours (immediately after lectures) and rearranged spring classes and senior thesis topic in order to avoid him.",Humanities,Elite Institution,Male,Graduate Student,Graduate Student,189
53,"This is predation rather than harassment, and at the time I thought I was an equal participant in an affair with an older male (married) professor. But now I realize I was one of his many victims. He would groom and then seduce students, grad and undergrad, telling us how unhappy his marriage was and how we made him feel alive etc. I'm pretty sure we all felt special and chosen, and at the time consented. But looking back it feels revolting.  ",Humanities,Research Institute,Male,Graduate Student,Chair/Dean/Head,84
54,"Colleague used sexual innuendo frequently in interpersonal contexts, meetings, and the classroom.  When I interviewed he whispered to me “I just watched you being seduced” after the waitress at lunch convinced me to try their homemade dessert.  Really gave me the creeps.  Red flags went up and I talked to several friends and mentors before I accepted the offer.  He also wrote bad horror fiction with mildly pornographic scenes that he asked female colleagues and students to read. His behavior was more troubling with 2 female colleagues than with me - asking specifically about their sex lives.  One colleague complained to the Dean before she left the institution.  I also heard students complained to the Dean about him on occasion.  ", Social sciences,Research Institute,Male,Faculty,Faculty,128
55,"Professor X not only has a reputation on campus as being utterly pretentious and condescending to students, but takes every opportunity to be sexually explicit in class (under the guise of being his “scholarly interests”). He has a well-established reputation as “creepy” and it is known that he has made advances toward female undergraduate students (myself included) ", Social sciences,Regional College,Male,Graduate Student,Faculty,58
56,"I had just finished my undergraduate thesis and was still at the College, preparing to apply to graduate school. My male adviser wanted to have an affair with me. I did not want to have an affair with him, but felt pressure to do so. I then tried to break it off, very clumsily I am sure since I was about 21 and felt that the whole situation was unbearably awkward. He was close friends with my other adviser, a feminist professor whom I had been working under for a long time and looked up to. He must have complained to her. When I asked her to write letters of recommendation for me for graduate school, she refused. She told me that she did not like how I had treated her friend, and therefore could not recommend me as a colleague. It was a consensual affair, so I do not blame him overly much, though clearly I was too young to be involved with him and there was a power imbalance in the relationship because of his role as my mentor. I blame more my feminist adviser for her vindictiveness, which I feel breached an acceptable standard of professional ethics. ",Humanities,Elite Institution,Other,Graduate Student,Faculty,201
57,"Over the course of three years, I was subjected to sexual innuendos and subtle intimidation from a professor who was the only one teaching classes I was required to take.  Incidents took place in his office when I was supposed to be getting feedback on my writing.  He commented on my weight, my age, suggesting that I would be prettier if thinner.  That I was too old to do well in grad. school.  That I needed to be more ""submissive"" (his word.)  He suggested that he was still sexually interested in me despite my ""flaws"" (his word.)",Humanities,Research Institute,Male,Graduate Student,Faculty,102
58,"I don't even feel comfortable writing this anonymously - it was such a bad situation. Basically my advisor came onto me really aggressively. He grabbed my breasts, stuck his hands down my pants, and begged me to let him perform oral sex on me. When I expressed shock and pushed him away (trying not to reject him too forcefully as I knew there would be repercussions, but gently saying we had a good professional relationship, and what about his wife?), he asked why I mentioned that my boyfriend and I had broken up if I wasnt interested. Two weeks later I needed a recommendation letter for a pre-doc, and he said he wasnt sure he had the time. That's when I knew that my career was over if my dissertation chair wouldn't write me recommendation letters. So I decided to normalize the situation and give him a way out by apologizing for the confusion. He took it, saying it was unlike him and he was under a lot of stress. And I never brought it up again. ", Social sciences,Elite Institution,Male,Graduate Student,Chair/Dean/Head,178
59,"Two years ago this upcoming spring, a prospective graduate student visiting my department took advantage of a dinner party that my friends and I held to welcome prospectives to the department to make inappropriate comments to myself and another female graduate student (both much younger than he). He made smacking motions behind the other graduate student's back when she bent over, miming spanking; and he told me repeatedly that I was ""dangerous"" in my low-cut dress, that he and his wife are in a don't ask, don't tell relationship, and that he is allowed to do what he wants on the top half of a woman. He was also aware that both me and my friend were involved with other people at the time.  ",Humanities,Research Institute,Male,Graduate Student,Graduate Student,126
60,"I was part of a hosting team for a graduate student recruiting event; a large group of prospective graduate students, current graduate students, and faculty were at a dinner off campus.  A professor seated across from me wrapped his fingers around the beer can in front of him, peered at me with alcohol red eyes, and asked ""do you think you could take it?  I'm about this size....."".  His demeanor, facial expression, and voice intonation clearly signaled that he relished the idea of committing physical harm to me, much as a sadist would.  The entire night I felt his eyes following me, and I became very afraid.  I made certain to leave with a group of other students, and I never participated in a recruiting weekend again.  Occasionally I heard gossip of this man's sexual overtures and bad behaviors towards other students, but this is thirdhand at best.",Natural sciences,Research Institute,Male,Graduate Student,Graduate Student,154
