,event,cleandiscipline_new,itype,gendersquash,cleantarget_new,perpetrator_new,story_word_count
28,"While I was a graduate student, I met a tenure-track professor at the AAAs whose work I liked and who had been recommended to me as someone to connect with. We spoke initially at a panel (he offered to read my dissertation draft and suggested we collaborate on some work) and then later continued the conversation at a drinks party for our AAA section. He and another male tenure-track professor in our field bought me multiple drinks, and he told me he was separated from his wife and they were getting a divorce. We left together and everything that happened was consensual, but six months later I received an e-mail from his wife (still married, not separated, not divorced) telling me that she knew all about our ""highly inappropriate relationship"" and that I should never contact him again. She contacted me as well through Facebook, and continued to message me. I don't know how she found out or got my contact information, but I never responded because I was so mortified and had no idea what to say, and didn't want to add fuel to the fire.", Social sciences,Research Institute,Other,Graduate Student,Faculty,187
29,"Forcefully kissed and groped twice. Once in front of several others in my own and related fields. One person tried to help me get away in the moment, while others ignored the situation or egged him on. Later cornered by the same individual in private and again forcefully groped and pressured to engage in sexual acts. ",Formal sciences,Multiple,Male,Graduate Student,Graduate Student,57
30,"I was sexually assaulted by another grad student. He engineered a situation in which the rest of us drank excessively while he only appeared to do the same. I started to regain consciousness while he was groping me. When I refused to keep quiet about what he had done, he portrayed it all as consensual. Mutual ""friends,"" both male and female, spread rumors about me, portraying me as unstable or alleging that I had pursued him. Some of these people lied about events when the university conducted their investigation. Following the investigation, I was black-balled by other grad students. At least one student continued to repeat the story of how I had ""wronged"" her friend four years after the assault, spreading her allegations to people completely unconnected to the situation. ",Humanities,Research Institute,Male,Graduate Student,Graduate Student,131
31,"A senior professor in my research area frequently commented on my body, dress, fitness level, etc. He would corner me at department social events, making me feel humiliated and trapped. He would also ""mistakenly"" touch me inappropriately (graze my breast when reaching out to touch my shoulder, sneak up behind me in the kitchenette and reach for the fridge, placing his hand over mine, which was already on the door, etc.)",Formal sciences,Elite Institution,Male,Graduate Student,Faculty,71
32,"On my very first day as a Teaching Fellow, an older male faculty member told me that the best piece of advice he could give me is to always erase the chalkboard up and down, rather than side to side-- that way ""my ass won't shake."" Similar comments have continued ever since. Now at adjunct status, I feel relatively powerless and generally just grin and bear it. ",Humanities,Regional College,Male,Faculty,others,68
33,A professor took a staff member out to dinner to proposition her in the guise of offering her a new job. He continued to harass her and other colleagues of mine. The moment I took my job I was warned about him and other male professors like him were pointed out to me. ,Applied science,Elite Institution,Male,Staff,Graduate Student,54
34,"At a social event following a national conference, a tenured professor insisted that I kiss him. He was married, but insisted that it was fine, and, when I refused, he said that ""his girlfriend says he's the best kisser"" and that I would be ""missing out."" He waited for me outside the women's restroom, making it so I couldn't walk out without him noticing. I ended up slipping away into a group of strangers who, after I explained the situation, offered to ""hide me"" from the man in question.",Humanities,Research Institute,Male,Graduate Student,Chair/Dean/Head,89
35,"I was good friends and then briefly dated someone in my field. During that short period, he made a lot of inappropriate comments about the appearance and bodies of other women in our field that he found attractive. He also would often describe women in more benign, but still sexist ways—he was particularly fond of calling women ""intense"" in a disapproving way. (He has crafted much of his reputation on being a ""chill,"" fun person.) I've also witnessed him use his stature to intimidate women in social situations, as well as speak directly over them in professional settings.",Humanities,Elite Institution,Male,Graduate Student,Graduate Student,98
36,"1989. The professor, who was directing my senior thesis, called me into his office and told me stories of his friends sexual exploits, told me I was “pure” and “sensitive,” showed up at my apartment with a case of beer, reminded me that he was grading my senior thesis, workshopped my story when I wasn’t present in workshop, told me that when he arrived he received a “list” of students to pay attention to and that I was on this list, had a poster for Playboy’s fiction contest on his door and pointed to it suggestively and said, “You should submit.” A lot of other flirtatious passive-aggressive stuff happened that I no longer remember. He was very confident in his “mentoring” of me.",Humanities,Research Institute,Male,Graduate Student,Faculty,123
37,"I heard from male peers about a certain celebrated male professor who only bonded with students over a smoke and drugs in the late evenings. While he did not make advances towards me or anyone I knew, we knew as women that we would never be included in the inner circle of the department, where opportunities for grants, co-authorship of papers etc, available teaching positions were discussed and given out because we were not deemed attractive or flirtatious enough to be included. It was an almost exclusively male circle, and the only women who were included by this prof and his junior male colleagues were either their partners or soon became their partners. Most of them did not go on to pursue serious academic work. ",Humanities,Research Institute,Male,Graduate Student,Faculty,126
38,"A professor requested my friendship on Facebook when I was in his class. He also requested the friendship of another young woman in the class and nobody else. He posted on our walls suggestively. He showed up at her work when she was bartending a propositioned her for sex. He told me he no longer has sex with his wife. He texted her his room number at a conference. I told my ""feminist professor"" about this and she just told him about it and he made fun of me for complaining. ",Humanities,Research Institute,Male,Graduate Student,Faculty,92
39,"I was a graduate student and in an elevator with a male tenured professor in my department, who advised one of my comprehensive exams. When the elevator doors closed, the male professor slowly looked my body up and down. Then he did it a second time. He wasn't even trying to hide what he was doing. He told me I looked nice and asked me why I was so dressed up today. I managed to squeak out an answer (something about how I was teaching that day), and then fled the elevator as soon as the doors opened. This faculty member very publicly leers at other women graduate students in my program (even when he's teaching us in the classroom), and he has a history of other inappropriate behaviors toward women students.",Humanities,Research Institute,Male,Graduate Student,Faculty,132
40,"I went to see my professor about a paper I was working on.  He had already commented a few times in class and in the hallways about my ""big, blue eyes"". 
 In his office, with the door closed told asked me if I was scared (be cause my eyes were so big).  I said, ""No."" I didn't know what else to do.  Then he told me he liked my ring and w/out consent took my hand and admired my ring for a good long while, while I waited silently for him to give me back my hand.  A few minutes later after I attempted to return the conversation to my paper,   he again commented on my ring and said, ""It's a shame you bit your nails.  You could have very beautiful hands.|",Humanities,Other Type of School,Male,Graduate Student,Faculty,140
41,"I was glad I passed my thesis defense. But that was not the end. I was told to revise the thesis drastically to meet his unrealistically high expectation. After satisfying all committee members' request, I was held hostage working to improve my thesis, and delayed my graduation, my chance to get my work visa on time, and missed a job opportunity.

A year later, I published an extension of my thesis work with my then collaborators, without my advisor as a co-author. He didn't like the idea of this extended work when I presented it to him while I was his student. After knowing about this published work, he sent an accusation email to the editor-in-chief of that journal and IEEE's person who oversees academic misconduct, and accused me of plagiarism. The editors dismissed the accusation after their investigation. But this was not the end. He said he will keep investigating. 

I'm now working in a university. It took me 4 years to overcome the fear and self-doubt. I never asked him for recommendation letters, and never told him where I went. But he still follows me, finding my new email address and sent me emails, asking me to work for him. At one point I told him to stop contacting me. He then used one of my friend (who was also his student) to send me messages. 

I wasn't his only victim. He got suspended twice by the university due to various reasons. However, he manipulated some of his students. One of them sent us this:

""Dear All,

As you remember, Dr. X was suspended last year, and I sent a request to you all for your support to Dr. X... 

After that suspension was due, the university started an investigation, which was completed in August this year.  Unfortunately, Dr. X has been suspended again still without any pay or permission given to contact his students since August this year. They accused Dr. X of mistreating, bullying, or harassing students, which is untrue. 
......
At this moment, we also still need your support. Would you please update your letter you wrote last year, sign it and then send the scanned copy to me?""

I hope my case can give the community some encouragement that not all harassment cases are silent. The investigation was conducted by the university. They did something in hope for a change. I hope more schools and departments can stand up for the students who are vulnerable, and in most cases chose to be silent. ",Applied science,Research Institute,Male,Graduate Student,Faculty,416
42,"Staff at research center said my lipstick was sexual. Then something about my using lipstick was me showing my vagina or wanting to show my vagina. I just felt deeply uncomfortable and more black pants, black shirt an no make up and left hair messy to not be talked too. Dean of my head school college frequently referred to grad students as sweet girls.",Humanities,Research Institute,Male,Graduate Student,Staff,64
43,"I was harassed and cyberstalked by a Professor who became fixated on me. My career was in its fledgling stages and he would google me to find my work on the internet and come to my office to ask deeply personal questions about it. He began emailing me and frequently messaging me using an internal messaging app, which he set to ""private"" so the messages were not recorded. Often he say things such as ""I need to talk to you. Can you come to my office?"" which I would ignore, prompting him to turn up at my office which I shared with my supervisor (female) who was bullying me. At a Christmas party he had some drinks and approached me, saying that he knew I was uncomfortable with his fascination with me, but that he was married and it ""wasn't sexual"". He took a photo of me at the party that night and told me sent it to a friend of his to ""show"" him the kind of young women he worked with. After the party, the harassment escalated, with emails, messages, phone calls and (when these were ignored) aggressive visits to my office.  ",Applied science,Elite Institution,Other,Staff,Faculty,196
44,"A grad student tried to rape another grad student in a hotel during a conference. He disregarded the fact that she already had a partner when he was coming on to her as well as the fact that she is queer and had no interest in him for multiple reasons. The department took no action against this student. He went on to win an award and get a tenure-track job. One of the most disturbing parts is that his research is about doing ethnographic research on incarcerated juvenile girls, so who knows what kinds of disturbing access he has to this vulnerable population and what types of things he may have tried to do. Also, the chair of the department was female yet was complicit in allowing his attempted rape to go completely unchecked. Meanwhile, the woman he tried to rape suffered severe mental health repercussions.", Social sciences,Research Institute,Male,Graduate Student,Graduate Student,146
45,"As a first-year grad student, I and another female cohort member were attending a sponsored party at the field's annual meeting. One of our professors introduced us to his PhD advisor, a preeminent scholar from another institution. The advisor immediately congratulated our professor for having arrived at the party with two gorgeous women, and insinuated that our professor should consider ""sharing"" us with him. ", Social sciences,Research Institute,Male,Graduate Student,Faculty,65
46,"When I was a doctoral candidate (1985-95), I held several part-time teaching jobs at various colleges and universities. One of my first ones was in a small art history department at a well-known art school. An older male (full-time) faculty member was very friendly. He was European, single and it was initially unclear to me how to interpret his somewhat excessive attention. All of the department faculty—part-time and full—shared a room dominated by his desk and the adjacent desk of the woman who chaired the department. One day I was seated nearby, preparing for my class. The chair was busy on a phone call and the male prof suddenly asked me why in African sculpture male genitals were so “exaggerated.” Annoyed by the question, I was a silent for a second. The real answer I knew was that in African art male and female genitalia symbolize human and agricultural fertility. But doubting his interest was strictly intellectual, I decided to shut down the discussion by deadpanning, “Oh, they’re not exaggerated.” I saw an amused grin on the woman chair’s face. The male prof didn’t bother me with any impertinent questions again.",Humanities,Other Type of School,Male,Faculty,Faculty,191
47,"After my leave of absence I approached a professor and asked him if I could pass his final exam by submitting an essay to a booklet that other people from the course were putting together. That booklet was in fact their final. To what he replied, with other people present, ""How about you dance naked on a table for me?"" After  a pause, he added ""You'll have to come and answer questions no essays possible for you."" On the day of the exam, he was talking for an hour and a half and told me about a movie that had a blow job reference in it. That happened on a Saturday evening when everyone had already left. I was scared but didn't show it. In the end, he gave me a good grade and I left. ",Humanities,Other Type of School,Male,Undergraduate Student,Faculty,138
48,"The Dean greeted me at a faculty meeting by kissing me on my neck.  He was aiming for my face but I flinched.  About a week later I met with him and told him that this had made me very uncomfortable. I asked him not to touch me again.  He apologized, but it was clear that he did not think he had crossed any boundaries.",Humanities,Other Type of School,Male,Faculty,Chair/Dean/Head,68
49,"Undergraduate at Florida State in General Education courses. Western History & Civilization professor would stop lectures and compliment my outfits, no matter how modestly I dressed. When the other students would audibly groan or make other comments, I would put my hand over my face and sink into my seat. Every time I did that, he would loudly announce ""Oh, c'mon, it's not like I'm trying to DATE YOU or anything!"" I had an A in the class, but he would pull me aside after class to demand I meet him in his office to 'discuss' my grades. I agreed once and brought another female student with me, which angered him. He began making negative comments to me in class, so I withdrew close to the last withdrawal date. Back then, before internet, in order to withdraw you had to take a form from the registrar and obtain your professor's signature. I approached him at the end of another class he was teaching, handing him a textbook and the form on top to sign. He scowled at me, and when he finished signing THREW the book, form, and pen at me.

Around the same time, my theatre professor kept trying to get me to go to his community theatre productions for ""extra credit,"" but they always included a stop at a bar afterwards. I went once and called a friend to come get me, and he drunkenly cornered me and tried to get me to stay (saying he had a wife, and she wouldn't mind). I declined, and never went again. About a week later, I was standing at a streetcorner waiting for the light to change, and a man began catcalling me from his car. It was the same theatre professor, telling me what he wanted to do to my ""hot little tits"" and my ass. I don't think he recognized me, but he got the nickname *** ""Catcall"" *** until I left Tallahassee. I tried to make myself as invisible as possible until the end of the semester. In 2016, he began posting in the Florida ""Indivisible"" Facebook group; I immediately recognized him 25 years later. He has public posts objectifying women who strip for a living, among others, and I reported him to (with my story) to the admins.",Applied science,Research Institute,Male,Graduate Student,Faculty,381
50,"This is just the worst of several harassers during that degree: From 1999 to 2002 a classmate slowly morphed into a cyber-stalker. Some of the lowlights included: 1) discovering that he had programmed a tracking app that checked every 5 minutes whether I was logged in, and in what room, which explained why he always seemed to show up wanting attention as soon as I arrived at work, 2) the time he insisted that I really meant yes even though I was repeatedly shouting no, because some guy had once told him that erect nipples indicate arousal (it was a hot Saturday afternoon, and I'd briefly gone into the air-conditioned office to grab something, while wearing a tank top), so he wouldn't stop hugging me, 3) the other time he wouldn't stop hugging me and I had to pour my drink down his back to get him to back off, 4) the time he physically blocked me from leaving his apartment, insisting I had to sleep there, then after I tricked him into complacency by pretending to give in, and made a run for the door, he threatened to throw himself over the banister of the very steep staircase if I didn't stop (I did finally convince him to let me leave), and finally, 5) after I cut off all contact, stopped answering my office phone, and told others in my lab not to let him in, he hacked into my email so that he received a copy of all of my incoming mail for 2 months, then unsatisfied with only getting incoming mail not outgoing mail, tried to hack further into the system and finally got caught by the sys admins.",Formal sciences,Research Institute,Male,Graduate Student,Graduate Student,282
51,"2008-2009: In my first year of grad school, I had a group of friends who were several years ahead of me in the program whom I referred to as my ""shadow committee""; they gave me feedback on work, advice on coursework/the department/dealing with my real advisors, and so on. I cherished them as friends and mentors. The ""chair"" of my shadow committee was a man who is about 20 years my senior and was 4 or 5 years ahead of me in the program.  He was a self-described feminist who was well known for his somewhat radical sexual ethics.
In the summer of my first year, both my ""shadow chair"" and I were going to be in Europe. We made a plan to meet up and spend several days being tourists together. The night before he flew over (my flight was a few days later) he confessed that he was deeply attracted to me and wanted to pursue a sexual relationship. I was stunned and said ,""thank you for telling me."" The next time I saw him was in Europe. I felt scared and uncertain; like I could either lose him as a friend and mentor or, somehow, part of me.  One night when we were there he started kissing me and asked if we could do certain other sexual acts. I said no. He didn't listen.
",Humanities,Elite Institution,Male,Graduate Student,Graduate Student,228
52,"There are too many microaggressions to even list- constant sizing up by male colleagues, comments on my clothing, weight, etc. Two representative incidents:
A male undergrad became fixated with me when I was a TA. He would follow me to my office after class, tell me about his personal problems, anf finally, he begain following me on the train. I told the professor of the course and he said, the semester is almost over, it will blow over- asked that i didn't make a big deal and advised that a complaint would be seen negatively in the department. 
Another incident occured when I was a brand new asst. professor and I returned to my grad institution for a visit. When I saw a former professor he said. ""Now that you are employed and don't need references I can finally try to fuck you."" I was so uncomfortable I  laughed it off saying ""Good Luck!""  He kept emailing and showed up in the audience at two talks I gave that were unrelated to his field. I have stopped going to national conferences out of fear f seeing him. I know many women that do not attend the AHA conference in order to avoid creeps.",Humanities,Research Institute,Male,Graduate Student,Undergraduate Student,204
53,"about 6 months ago, a cis-man who was my mentor in my undergraduate degree explicitly hit on me via Facebook messenger. I'm now a Ph.D. student at the school he attended. We share similar speech/debate/academic circles. He was my mentor -- he wrote me a glowing letter of recommendation to two of my universities. He's married and I have discouraged him from these types of highly charged messages. I have sought to redirect his amorous attention back to his marriage. I would like to preserve this mentorship/friendship, and have tried to be empathetic to circumstances which might be leading him to seek out sexual fulfillment in me. However, this has really damaged my view of him and has negatively impacted me. I've started to wonder if I he wrote my letters of recommendation because he was sexually attracted to me and does this mean I'm not fit for academic work? 

Another incident mirrored this when I was a student on a competitive speech team at the same age when I was my mentor's student. I received explicit messages from my married coach about how ""sexy"" and ""pretty"" and ""hot"" I was. ""What would you think of me doing X to your body"". The speech season had just ended and I was graduating -- I think he thought he was in the clear because he wasn't my coach anymore?", Social sciences,Multiple,Male,Graduate Student,Undergraduate Student,228
54,"(1) A professor invited a student over to her house after she asked for feedback on a presentation. He opened the door wearing his underwear and didn’t change the entire time she was there. (2) A fellow grad student anonymously sent naked photographs of a student in another department to her employers once she graduated and started her new job. Told them she had various STDs and couldn’t be trusted. He was her ex. (3) A fellow grad student stalked and harassed another grad student for 8 months, alternating between begging her to give him a chance and threatening her (or suicide) if she didn’t. She had to call the police on more than one occasion and eventually she left the town our school is in to finish her PhD. (4) Apparently, he did this to several other students as well - begged for sex and lashed out with various threats if they weren’t interested. (5) Another grad student was known to harass women; several of them filed a complaint in our department. ", Social sciences,Elite Institution,Male,Graduate Student,Graduate Student,174
55,"A professor made continual sexist and homophobic comments to masters & doctoral students throughout the semester. He noted that he has “a hard time” seeing two men kiss because it’s “like pouring ketchup on cereal. It doesn’t belong.”  Made a number of other comments about gender, people who get “sex changes,” and noted that serial killers who target prostituted women are brilliant because “no one cares about prostitutes.” He also said he would rather go to a concentration camp than watch Bravo television with his wife. There were other comments, too. This is just a glympse. ", Social sciences,Research Institute,Male,Graduate Student,Faculty,98
