,event,target,cleantarget,perpetrator,perpgender,gendersquash,cleandiscipline,itype,cleantarget_new,perpetrator_new,cleandiscipline_new
1347,"When I was a first year graduate student, I started dating another student in my department who was a year ahead of me. The emotional abuse started early; assuming that I could not handle the problem sets on my own, he gave me all of his from the previous year. He constantly invalidated my feelings, suggesting each time I got upset that ""that's such a rich white girl thing to get upset over."" When I made comments during conversations, both one-on-one and in larger groups of physics grad students, he would frequently invalidate me, suggesting that I had seen nothing of the real world, and that I was nothing more than a wealthy sheltered child. 

Over time, he became increasingly controlling, and I feared retaliation when I wanted to end the relationship. I remained in that state for three and a half months. When I finally did, serious harassment ensued. He would drive by my house repeatedly, wait at the end of the bike path where he knew I liked to ride, and occasionally sit on my front steps and wait for me to get home at the end of the day. One day, he chased me out of the gym and screamed at me on the athletic quad. During departmental coffee hours and other social events, he would glare at me, shifting his position to maintain his line of sight. He texted me a death threat, and spread rumors in the department that I cheated on my problem sets and exams. He also circulated the rumor that I was only accepted into the program because of my gender identity, and that I only passed the first year because I am pretty. When I told my close friends about the harassment, many abandoned me, saying that it was my fault for breaking his heart. 

Since there were virtually no female faculty members in my department, and certainly none with whom I had ever conversed, I went to the administrative coordinator. She put me in touch with the Title IX office. The possible paths forward included an on campus no-contact order (which would not protect me in my off campus residence or neighborhood), or a full on restraining order. The Title IX office suggested that if I feared further retaliation, I should not press charges. I was extremely fearful of retaliation. For the remainder my my second year, I only went to campus to attend class. I would arrive five minutes late to the class that we were both enrolled in, and left five minutes early to avoid possible interaction. For the rest of the time, I worked from home. After year two, I left physics. ",Graduate student.,Graduate Student.,Graduate student in the same department.,Male,Male,Physics,Multiple,Graduate Student,Graduate Student,Natural sciences
315,"You mean apart from the systemic devaluing of scholarly research on women's work and women's experience (my field) in the Ivy League (where I trained and spent the crucial early years of my career)? Apart from the saddling of women with almost ALL administrative service responsibilities as well as real emotional labor on behalf of students and colleagues, all the time? Apart from those things, I was propositioned, groped, and offered quid pro quos from 3 different distinguished professors in my field on many occasions. Five years ago, I left academia for good. Enough is enough. At least in the corporate world reporting structures exist, and sometimes they even work the way they are supposed to.","graduate student, assistant professor","graduate student, assistant professor",all full professors,Male,Male,Theater,Multiple,Graduate Student,Faculty,Humanities
675,"A professor openly flirted with me in class before suggesting, in a closed elevator with me, that our ""relationship"" may go further.",Graduate student,Graduate Student,Tenured professor--not on my committee,Male,Male,Literature,Research Institute,Graduate Student,Faculty,Humanities
